{"acceptanceCriteria":[{"criterionId":"one-adult","description":"Exactly one adult hero; no duplicated body or anatomy.","required":true},{"criterionId":"complete-full-body","description":"Full head, both hands, and both feet are visible with safe margin.","required":true},{"criterionId":"painted-register","description":"Cinematic semi-realistic painted drawing, visibly painterly and not photographic or cel-anime.","required":true},{"criterionId":"manifest-fidelity","description":"Body, height, age, skin, hair, clothing, palette, and detail manifest remain legible.","required":true},{"criterionId":"neutral-expression","description":"Calm neutral expression without smile, grin, or theatrical acting.","required":true},{"criterionId":"one-star-ceiling","description":"Ordinary mortal presentation with no weapon, magic, affinity cue, elite armor, frame, star, UI, or text.","required":true},{"criterionId":"original-identity","description":"Does not reproduce a declared style reference's face, body, hair, or outfit.","required":true}],"canonicalPrompt":{"sha256":"ec84725524a4dc462045e221bd6f11760f840c6742b7916923f89ae135e2dbbc","text":"Create one original Summonlab candidate summon portrait as a cinematic semi-realistic painted drawing. Use visible brush planes and controlled illustrative detail: not a photograph, not photoreal skin, not plastic 3D, and not cel anime. Portrait canvas 1024 x 1536. Exactly one weaponless adult, full body, three-quarter standing pose, with the entire head, both hands, both feet, hair, clothing, and all accessories fully inside a generous safe margin. Warm pale parchment studio wash, restrained warm color response, soft grounding shadow, no environmental story.\n\nNew identity Talia Coren: 36-year-old woman, 174 cm (medium), plus-size heavy construction with substantial natural mass, skin value band-5-medium-deep. Face: long narrow face; wide-set eyes and a low straight brow; aquiline nose, softly full mouth; no added facial mark. Calm closed-mouth neutral expression with no smile, grin, or theatrical acting.\n\nHair: red-copper-auburn, shaved-close-cropped, deliberate accent: sculpted edge pattern. Wardrobe: asymmetric-patchwork, specifically intentional patchwork layers with an uneven hem, visible repairs, and practical trousers; low-profile toggles and articulated knee folds; bounded palette teal-brown. Visible personal details: a compact finger-line tattoo family. Make a tattoo, scar, freckle field, or birthmark the primary recognition device. Maintenance cue: ornate hair maintenance with plain clothing care. Color treatment: uses high-contrast lining visible only in motion. Pose cue: one thumb hooks lightly beneath the waist wrap while the other hand rests open. Include a wooden thread gauge only as a quiet personal object, never as a weapon.\n\nThis is ordinary but intentionally designed 1-star mortal clothing. No weapon, armor, crown, magic, aura, or glow. No affinity cue, elemental gem, floating, frame, printed star, number, UI, logo, watermark, text, extra person, duplicated anatomy, cropped extremity, or published-character resemblance. Fantasy hair colors are matte dye or pigment, never supernatural emission. Preserve plausible anatomy while allowing the declared body construction to be extreme. Do not copy the reference's person, braid, clothes, pose, palette, progression, identity, body, hair, garments, ornaments, or markings.\n\nRESERVE ACTIVATION: This is a fresh base summon, not an edit or regeneration of any existing hero. Create the new identity described above using only the authorized rendering-style reference. Honor the complete activated physical manifest and reserve character kernel; no failed hero or failed candidate is a visual source."},"correctionSource":null,"experimentId":"one-star-overnight-200-001","heroId":"talia-coren","heroSpec":{"details":{"anchors":["a compact finger-line tattoo family"],"coolnessAnchor":"durable-body-marking","density":1,"tattooScope":"bounded"},"hair":{"accent":"sculpted edge pattern","chibiReadability":"Preserve the front and side silhouette of shaved-close-cropped, the parting, gathered mass, shaved areas, and sculpted edge pattern; color remains red-copper-auburn.","colorFamily":"red-copper-auburn","silhouetteFamily":"shaved-close-cropped"},"identity":{"age":36,"displayName":"Talia Coren","faceDescription":"long narrow face; wide-set eyes and a low straight brow; aquiline nose, softly full mouth; no added facial mark","gender":"woman","identitySignature":"c82496986db0792167cd92768c9f1898445cf9f89f9c2d0d03b667cbeb98bffd","skinValueBand":5},"kernel":{"colorOrnamentTaste":"uses high-contrast lining visible only in motion; enjoys two mismatched personal details.","counterTrait":"avoids conflict until a boundary breaks","culturalFragments":["reads knot patterns as personal signatures","turns repaired seams outward during celebrations"],"dominantTrait":"warmly argumentative","groomingAttitude":"ornate hair maintenance with plain clothing care","lifeEcho":"construction","nonInference":"Do not infer aptitude, intelligence, spirit, morality, combat role, rarity, or biography from body, face, gender, skin, age, or phenotype.","poseCue":"one thumb hooks lightly beneath the waist wrap while the other hand rests open","socialPresentation":"relaxed but exacting","tension":"Appears relaxed but exacting, yet avoids conflict until a boundary breaks."},"physique":{"bodyType":"plus-size-heavy","description":"174 cm; plus-size heavy construction with substantial natural mass.","heightBand":"medium"},"wardrobe":{"condition":"ornate hair maintenance with plain clothing care","description":"intentional patchwork layers with an uneven hem, visible repairs, and practical trousers; low-profile toggles and articulated knee folds.","family":"asymmetric-patchwork","paletteFamily":"teal-brown"}},"imageKind":"summon","output":{"candidatePath":"assets/heroes/experiments/one-star-overnight-200-001/waves/wave-10/candidates/talia-coren/summon-v1.png","resultPath":"assets/heroes/experiments/one-star-overnight-200-001/waves/wave-10/results/talia-coren/summon-v1.json"},"presentation":{"composition":"Exactly one weaponless adult, full body in a grounded three-quarter standing pose; all extremities inside a generous safe margin on a warm parchment studio wash.","height":1536,"mediaType":"image/png","negativeConstraints":["no weapon, armor, crown, magic, aura, affinity cue, elemental gem, or floating","no frame, printed star, number, UI, logo, watermark, or text","no extra person, duplicate anatomy, crop, smile, grin, or theatrical expression","no photographic pores, lens treatment, plastic 3D, cel-anime finish, or published-character resemblance"],"width":1024},"productionState":"candidate-only","references":[{"path":"assets/heroes/visuals/style-references/current-hero-rendering/ochre-braid-progression-reference.png","purpose":"Rendering-register reference only: painterly realism ceiling, full-body parchment composition, and warm color handling. Do not transfer its person, braid, clothes, pose, palette, progression, identity, phenotype, anatomy, hair, wardrobe, or accessories.","role":"rendering-style","sha256":"5b4a0f09271bc0fd1914614d50c4977cef6db50373d6357e9c5811aebb94f946"}],"schemaVersion":"hero-one-star-image-target-v1","sourceSummon":null,"starLevel":1,"targetId":"talia-coren-summon-v1","targetVersion":1,"waveId":"wave-10"}
