{"acceptanceCriteria":[{"criterionId":"one-adult","description":"Exactly one adult hero; no duplicated body or anatomy.","required":true},{"criterionId":"complete-full-body","description":"Full head, both hands, and both feet are visible with safe margin.","required":true},{"criterionId":"painted-register","description":"Cinematic semi-realistic painted drawing, visibly painterly and not photographic or cel-anime.","required":true},{"criterionId":"manifest-fidelity","description":"Body, height, age, skin, hair, clothing, palette, and detail manifest remain legible.","required":true},{"criterionId":"neutral-expression","description":"Calm neutral expression without smile, grin, or theatrical acting.","required":true},{"criterionId":"one-star-ceiling","description":"Ordinary mortal presentation with no weapon, magic, affinity cue, elite armor, frame, star, UI, or text.","required":true},{"criterionId":"original-identity","description":"Does not reproduce a declared style reference's face, body, hair, or outfit.","required":true}],"canonicalPrompt":{"sha256":"d8d3fb27c12713a9bd8743286d5d0f05b8b724973c6ba2a2957f92dbfdc5849a","text":"Create one original Summonlab candidate summon portrait as a cinematic semi-realistic painted drawing. Use visible brush planes and controlled illustrative detail: not a photograph, not photoreal skin, not plastic 3D, and not cel anime. Portrait canvas 1024 x 1536. Exactly one weaponless adult, full body, three-quarter standing pose, with the entire head, both hands, both feet, hair, clothing, and all accessories fully inside a generous safe margin. Warm pale parchment studio wash, restrained warm color response, soft grounding shadow, no environmental story.\n\nNew identity Galon Esho: 30-year-old woman, 178 cm (tall), soft rounded construction with an evident middle and gentle limb contours, skin value band-4-medium. Face: wide triangular face; small bright eyes and fine straight brows; prominent bridge, compact mouth; subtle age lines. Calm closed-mouth neutral expression with no smile, grin, or theatrical acting.\n\nHair: black, short-textured-crop, deliberate accent: contrasting side length. Wardrobe: quilted-outerwear, specifically lightly quilted cloth outerwear over a simple fitted layer and tapered trousers; rolled sleeves and one architectural lapel; bounded palette marigold-green. Visible personal details: a compact finger-line tattoo family; a wrapped keepsake cord. Make a tattoo, scar, freckle field, or birthmark the primary recognition device. Maintenance cue: visible mending treated as prideful craft. Color treatment: uses the palette boldly in large blocks. Pose cue: feet plant evenly while fingertips touch a small personal keepsake. Include a folded handkerchief only as a quiet personal object, never as a weapon.\n\nThis is ordinary but intentionally designed 1-star mortal clothing. No weapon, armor, crown, magic, aura, or glow. No affinity cue, elemental gem, floating, frame, printed star, number, UI, logo, watermark, text, extra person, duplicated anatomy, cropped extremity, or published-character resemblance. Fantasy hair colors are matte dye or pigment, never supernatural emission. Preserve plausible anatomy while allowing the declared body construction to be extreme. Do not copy the reference's person, braid, clothes, pose, palette, progression, identity, body, hair, garments, ornaments, or markings.\n\nRESERVE ACTIVATION: This is a fresh base summon, not an edit or regeneration of any existing hero. Create the new identity described above using only the authorized rendering-style reference. Honor the complete activated physical manifest and reserve character kernel; no failed hero or failed candidate is a visual source."},"correctionSource":null,"experimentId":"one-star-overnight-200-001","heroId":"galon-esho","heroSpec":{"details":{"anchors":["a compact finger-line tattoo family","a wrapped keepsake cord"],"coolnessAnchor":"durable-body-marking","density":2,"tattooScope":"bounded"},"hair":{"accent":"contrasting side length","chibiReadability":"Preserve the front and side silhouette of short-textured-crop, the parting, gathered mass, shaved areas, and contrasting side length; color remains black.","colorFamily":"black","silhouetteFamily":"short-textured-crop"},"identity":{"age":30,"displayName":"Galon Esho","faceDescription":"wide triangular face; small bright eyes and fine straight brows; prominent bridge, compact mouth; subtle age lines","gender":"woman","identitySignature":"f34b6ac69876f1a245847f731bb1c15ff81c1259adee7a3d4ee0cf3d07ce3d30","skinValueBand":4},"kernel":{"colorOrnamentTaste":"uses the palette boldly in large blocks; enjoys two mismatched personal details.","counterTrait":"keeps one ridiculous superstition","culturalFragments":["reads knot patterns as personal signatures","gives bright thread as a promise of return"],"dominantTrait":"serenely contrarian","groomingAttitude":"visible mending treated as prideful craft","lifeEcho":"animal care","nonInference":"Do not infer aptitude, intelligence, spirit, morality, combat role, rarity, or biography from body, face, gender, skin, age, or phenotype.","poseCue":"feet plant evenly while fingertips touch a small personal keepsake","socialPresentation":"precise and courteous","tension":"Appears precise and courteous, yet keeps one ridiculous superstition."},"physique":{"bodyType":"soft-round","description":"178 cm; soft rounded construction with an evident middle and gentle limb contours.","heightBand":"tall"},"wardrobe":{"condition":"visible mending treated as prideful craft","description":"lightly quilted cloth outerwear over a simple fitted layer and tapered trousers; rolled sleeves and one architectural lapel.","family":"quilted-outerwear","paletteFamily":"marigold-green"}},"imageKind":"summon","output":{"candidatePath":"assets/heroes/experiments/one-star-overnight-200-001/waves/wave-06/candidates/galon-esho/summon-v1.png","resultPath":"assets/heroes/experiments/one-star-overnight-200-001/waves/wave-06/results/galon-esho/summon-v1.json"},"presentation":{"composition":"Exactly one weaponless adult, full body in a grounded three-quarter standing pose; all extremities inside a generous safe margin on a warm parchment studio wash.","height":1536,"mediaType":"image/png","negativeConstraints":["no weapon, armor, crown, magic, aura, affinity cue, elemental gem, or floating","no frame, printed star, number, UI, logo, watermark, or text","no extra person, duplicate anatomy, crop, smile, grin, or theatrical expression","no photographic pores, lens treatment, plastic 3D, cel-anime finish, or published-character resemblance"],"width":1024},"productionState":"candidate-only","references":[{"path":"assets/heroes/visuals/style-references/current-hero-rendering/ochre-braid-progression-reference.png","purpose":"Rendering-register reference only: painterly realism ceiling, full-body parchment composition, and warm color handling. Do not transfer its person, braid, clothes, pose, palette, progression, identity, phenotype, anatomy, hair, wardrobe, or accessories.","role":"rendering-style","sha256":"5b4a0f09271bc0fd1914614d50c4977cef6db50373d6357e9c5811aebb94f946"}],"schemaVersion":"hero-one-star-image-target-v1","sourceSummon":null,"starLevel":1,"targetId":"galon-esho-summon-v1","targetVersion":1,"waveId":"wave-06"}
