{"acceptanceCriteria":[{"criterionId":"one-adult","description":"Exactly one adult hero; no duplicated body or anatomy.","required":true},{"criterionId":"complete-full-body","description":"Full head, both hands, and both feet are visible with safe margin.","required":true},{"criterionId":"painted-register","description":"Cinematic semi-realistic painted drawing, visibly painterly and not photographic or cel-anime.","required":true},{"criterionId":"manifest-fidelity","description":"Body, height, age, skin, hair, clothing, palette, and detail manifest remain legible.","required":true},{"criterionId":"neutral-expression","description":"Calm neutral expression without smile, grin, or theatrical acting.","required":true},{"criterionId":"one-star-ceiling","description":"Ordinary mortal presentation with no weapon, magic, affinity cue, elite armor, frame, star, UI, or text.","required":true},{"criterionId":"original-identity","description":"Does not reproduce a declared style reference's face, body, hair, or outfit.","required":true}],"canonicalPrompt":{"sha256":"cc3ba93cac48c320a55f0f42db65477e30627ddc5be79a5b44d0394cd5feb091","text":"Create one original Summonlab candidate summon portrait as a cinematic semi-realistic painted drawing. Use visible brush planes and controlled illustrative detail: not a photograph, not photoreal skin, not plastic 3D, and not cel anime. Portrait canvas 1024 x 1536. Exactly one weaponless adult, full body, three-quarter standing pose, with the entire head, both hands, both feet, hair, clothing, and all accessories fully inside a generous safe margin. Warm pale parchment studio wash, restrained warm color response, soft grounding shadow, no environmental story.\n\nNew identity Galel Kesha: 22-year-old woman, 195 cm (very-tall), ordinary lean-to-average construction without visible definition, skin value band-5-medium-deep. Face: long narrow face; deep-set eyes and a heavy level brow; broad low bridge, full lips; one brow notch. Calm closed-mouth neutral expression with no smile, grin, or theatrical acting.\n\nHair: blue-teal, medium-loose, deliberate accent: offset braid. Wardrobe: apron-workwear-layers, specifically a work shirt, asymmetrical apron layers, reinforced trousers, and sturdy shoes; visible hand repairs and contrasting inner edges; bounded palette rust-charcoal. Visible personal details: no accessory and no tattoo. Make body construction and habitual posture the primary recognition device. Maintenance cue: ornate hair maintenance with plain clothing care. Color treatment: uses high-contrast lining visible only in motion. Pose cue: one shoulder leads subtly and the gaze meets the viewer without a smile. Include a travel tally cord only as a quiet personal object, never as a weapon.\n\nThis is ordinary but intentionally designed 1-star mortal clothing. No weapon, armor, crown, magic, aura, or glow. No affinity cue, elemental gem, floating, frame, printed star, number, UI, logo, watermark, text, extra person, duplicated anatomy, cropped extremity, or published-character resemblance. Fantasy hair colors are matte dye or pigment, never supernatural emission. Preserve plausible anatomy while allowing the declared body construction to be extreme. Do not copy the reference's person, braid, clothes, pose, palette, progression, identity, body, hair, garments, ornaments, or markings.\n\nRESERVE ACTIVATION: This is a fresh base summon, not an edit or regeneration of any existing hero. Create the new identity described above using only the authorized rendering-style reference. Honor the complete activated physical manifest and reserve character kernel; no failed hero or failed candidate is a visual source."},"correctionSource":null,"experimentId":"one-star-overnight-200-001","heroId":"galel-kesha","heroSpec":{"details":{"anchors":[],"coolnessAnchor":"body-or-posture","density":0,"tattooScope":"none"},"hair":{"accent":"offset braid","chibiReadability":"Preserve the front and side silhouette of medium-loose, the parting, gathered mass, shaved areas, and offset braid; color remains blue-teal.","colorFamily":"blue-teal","silhouetteFamily":"medium-loose"},"identity":{"age":22,"displayName":"Galel Kesha","faceDescription":"long narrow face; deep-set eyes and a heavy level brow; broad low bridge, full lips; one brow notch","gender":"woman","identitySignature":"9654e05111fe2178034d59c598cf214a3573853960ab1e94a7880731a92eb46a","skinValueBand":5},"kernel":{"colorOrnamentTaste":"uses high-contrast lining visible only in motion; avoids ornament unless it serves a fastening purpose.","counterTrait":"is disorganized behind a polished exterior","culturalFragments":["favors narrow geometric woven borders","uses food spice order to mark seasons"],"dominantTrait":"quietly audacious","groomingAttitude":"ornate hair maintenance with plain clothing care","lifeEcho":"administration","nonInference":"Do not infer aptitude, intelligence, spirit, morality, combat role, rarity, or biography from body, face, gender, skin, age, or phenotype.","poseCue":"one shoulder leads subtly and the gaze meets the viewer without a smile","socialPresentation":"open and attentive","tension":"Appears open and attentive, yet is disorganized behind a polished exterior."},"physique":{"bodyType":"ordinary-average","description":"195 cm; ordinary lean-to-average construction without visible definition.","heightBand":"very-tall"},"wardrobe":{"condition":"ornate hair maintenance with plain clothing care","description":"a work shirt, asymmetrical apron layers, reinforced trousers, and sturdy shoes; visible hand repairs and contrasting inner edges.","family":"apron-workwear-layers","paletteFamily":"rust-charcoal"}},"imageKind":"summon","output":{"candidatePath":"assets/heroes/experiments/one-star-overnight-200-001/waves/wave-09/candidates/galel-kesha/summon-v1.png","resultPath":"assets/heroes/experiments/one-star-overnight-200-001/waves/wave-09/results/galel-kesha/summon-v1.json"},"presentation":{"composition":"Exactly one weaponless adult, full body in a grounded three-quarter standing pose; all extremities inside a generous safe margin on a warm parchment studio wash.","height":1536,"mediaType":"image/png","negativeConstraints":["no weapon, armor, crown, magic, aura, affinity cue, elemental gem, or floating","no frame, printed star, number, UI, logo, watermark, or text","no extra person, duplicate anatomy, crop, smile, grin, or theatrical expression","no photographic pores, lens treatment, plastic 3D, cel-anime finish, or published-character resemblance"],"width":1024},"productionState":"candidate-only","references":[{"path":"assets/heroes/visuals/style-references/current-hero-rendering/ochre-braid-progression-reference.png","purpose":"Rendering-register reference only: painterly realism ceiling, full-body parchment composition, and warm color handling. Do not transfer its person, braid, clothes, pose, palette, progression, identity, phenotype, anatomy, hair, wardrobe, or accessories.","role":"rendering-style","sha256":"5b4a0f09271bc0fd1914614d50c4977cef6db50373d6357e9c5811aebb94f946"}],"schemaVersion":"hero-one-star-image-target-v1","sourceSummon":null,"starLevel":1,"targetId":"galel-kesha-summon-v1","targetVersion":1,"waveId":"wave-09"}
