{
  "acceptanceCriteria": [
    {
      "criterionId": "one-adult",
      "description": "Exactly one adult hero; no duplicated body or anatomy.",
      "required": true
    },
    {
      "criterionId": "complete-full-body",
      "description": "Full head, both hands, and both feet are visible with safe margin.",
      "required": true
    },
    {
      "criterionId": "painted-register",
      "description": "Cinematic semi-realistic painted drawing, visibly painterly and not photographic or cel-anime.",
      "required": true
    },
    {
      "criterionId": "manifest-fidelity",
      "description": "Body, height, age, skin, hair, clothing, palette, and detail manifest remain legible.",
      "required": true
    },
    {
      "criterionId": "neutral-expression",
      "description": "Calm neutral expression without smile, grin, or theatrical acting.",
      "required": true
    },
    {
      "criterionId": "one-star-ceiling",
      "description": "Ordinary mortal presentation with no weapon, magic, affinity cue, elite armor, frame, star, UI, or text.",
      "required": true
    },
    {
      "criterionId": "original-identity",
      "description": "Does not reproduce a declared style reference's face, body, hair, or outfit.",
      "required": true
    }
  ],
  "canonicalPrompt": {
    "sha256": "a6b58b7f2906f6534fd1c48ca1acc9b26d88819ca431120df13bccd0041b2103",
    "text": "Create one original Summonlab candidate summon portrait as a cinematic semi-realistic painted drawing. Use visible brush planes and controlled illustrative detail: not a photograph, not photoreal skin, not plastic 3D, and not cel anime. Portrait canvas 1024 x 1536. Exactly one weaponless adult, full body, three-quarter standing pose, with the entire head, both hands, both feet, hair, clothing, and all accessories fully inside a generous safe margin. Warm pale parchment studio wash, restrained warm color response, soft grounding shadow, no environmental story.\n\nNew identity Gali Zharo: 41-year-old woman, 155 cm (short), healthy slight, narrow, long-limbed construction with low mass, skin value band-3-light-medium. Face: square compact face; full cheeks and sharply defined brows; small upturned nose, heavy lower lip; one cheek mole. Calm closed-mouth neutral expression with no smile, grin, or theatrical acting.\n\nHair: black, curls-coils-halo, deliberate accent: high gathered coil mass. Wardrobe: apron-workwear-layers, specifically a work shirt, asymmetrical apron layers, reinforced trousers, and sturdy shoes; a high soft collar and uneven layered hems; bounded palette moss-ivory. Visible personal details: no accessory and no tattoo. Make body construction and habitual posture the primary recognition device. Maintenance cue: meticulous daily maintenance. Color treatment: uses small rhythmic repeats of the palette. Pose cue: chin remains level while one hand lightly checks a cuff seam. Include a polished seed case only as a quiet personal object, never as a weapon.\n\nThis is ordinary but intentionally designed 1-star mortal clothing. No weapon, armor, crown, magic, aura, or glow. No affinity cue, elemental gem, floating, frame, printed star, number, UI, logo, watermark, text, extra person, duplicated anatomy, cropped extremity, or published-character resemblance. Fantasy hair colors are matte dye or pigment, never supernatural emission. Preserve plausible anatomy while allowing the declared body construction to be extreme. Do not copy the reference's person, braid, clothes, pose, palette, progression, identity, body, hair, garments, ornaments, or markings."
  },
  "correctionSource": null,
  "experimentId": "one-star-overnight-200-001",
  "heroId": "gali-zharo",
  "heroSpec": {
    "details": {
      "anchors": [],
      "coolnessAnchor": "body-or-posture",
      "density": 0,
      "tattooScope": "none"
    },
    "hair": {
      "accent": "high gathered coil mass",
      "chibiReadability": "Preserve the front and side silhouette of curls-coils-halo, the parting, gathered mass, shaved areas, and high gathered coil mass; color remains black.",
      "colorFamily": "black",
      "silhouetteFamily": "curls-coils-halo"
    },
    "identity": {
      "age": 41,
      "displayName": "Gali Zharo",
      "faceDescription": "square compact face; full cheeks and sharply defined brows; small upturned nose, heavy lower lip; one cheek mole",
      "gender": "woman",
      "identitySignature": "d0b71b9c0ae3e37cb1877a382a159b59edf4e8b2074c36d5fb5709aff3818941",
      "skinValueBand": 3
    },
    "kernel": {
      "colorOrnamentTaste": "uses small rhythmic repeats of the palette; avoids ornament unless it serves a fastening purpose.",
      "counterTrait": "is patient with novices, never experts",
      "culturalFragments": [
        "likes burnished clay beads and matte surfaces",
        "touches two fingers to the collar before greeting"
      ],
      "dominantTrait": "fiercely attentive",
      "groomingAttitude": "meticulous daily maintenance",
      "lifeEcho": "domestic care",
      "nonInference": "Do not infer aptitude, intelligence, spirit, morality, combat role, rarity, or biography from body, face, gender, skin, age, or phenotype.",
      "poseCue": "chin remains level while one hand lightly checks a cuff seam",
      "socialPresentation": "calm and appraising",
      "tension": "Appears calm and appraising, yet is patient with novices, never experts."
    },
    "physique": {
      "bodyType": "healthy-slight-lanky",
      "description": "155 cm; healthy slight, narrow, long-limbed construction with low mass.",
      "heightBand": "short"
    },
    "wardrobe": {
      "condition": "meticulous daily maintenance",
      "description": "a work shirt, asymmetrical apron layers, reinforced trousers, and sturdy shoes; a high soft collar and uneven layered hems.",
      "family": "apron-workwear-layers",
      "paletteFamily": "moss-ivory"
    }
  },
  "imageKind": "summon",
  "output": {
    "candidatePath": "assets/heroes/experiments/one-star-overnight-200-001/waves/wave-05/candidates/gali-zharo/summon-v1.png",
    "resultPath": "assets/heroes/experiments/one-star-overnight-200-001/waves/wave-05/results/gali-zharo/summon-v1.json"
  },
  "presentation": {
    "composition": "Exactly one weaponless adult, full body in a grounded three-quarter standing pose; all extremities inside a generous safe margin on a warm parchment studio wash.",
    "height": 1536,
    "mediaType": "image/png",
    "negativeConstraints": [
      "no weapon, armor, crown, magic, aura, affinity cue, elemental gem, or floating",
      "no frame, printed star, number, UI, logo, watermark, or text",
      "no extra person, duplicate anatomy, crop, smile, grin, or theatrical expression",
      "no photographic pores, lens treatment, plastic 3D, cel-anime finish, or published-character resemblance"
    ],
    "width": 1024
  },
  "productionState": "candidate-only",
  "references": [
    {
      "path": "assets/heroes/visuals/style-references/current-hero-rendering/ochre-braid-progression-reference.png",
      "purpose": "Rendering-register reference only: painterly realism ceiling, full-body parchment composition, and warm color handling. Do not transfer its person, braid, clothes, pose, palette, progression, identity, phenotype, anatomy, hair, wardrobe, or accessories.",
      "role": "rendering-style",
      "sha256": "5b4a0f09271bc0fd1914614d50c4977cef6db50373d6357e9c5811aebb94f946"
    }
  ],
  "schemaVersion": "hero-one-star-image-target-v1",
  "sourceSummon": null,
  "starLevel": 1,
  "targetId": "gali-zharo-summon-v1",
  "targetVersion": 1,
  "waveId": "wave-05"
}
