{"acceptanceCriteria":[{"criterionId":"identity-continuity","description":"The adult face, skin, age cues, and identity remain unmistakably the summon hero.","required":true},{"criterionId":"body-continuity","description":"Height language, shoulder width, torso width, mass, softness, and musculature match the summon.","required":true},{"criterionId":"arm-hand-continuity","description":"Upper arms, forearms, wrists, and hands preserve source proportions without generic chibi inflation.","required":true},{"criterionId":"hair-continuity","description":"Hair color, front and side silhouette, parting, gathered mass, shaved areas, and accents match the summon.","required":true},{"criterionId":"wardrobe-continuity","description":"Garment construction, palette, repairs, accessories, tattoos, and personal anchors match the summon.","required":true},{"criterionId":"chibi-ratio","description":"The adult combat chibi is 2.75 through 3.1 heads tall: the complete head-and-hair unit occupies about 32 through 36 percent of standing height, never 3.5 or 4 heads tall.","required":true},{"criterionId":"complete-full-body","description":"Exactly one full-body subject has the entire head, both hands, and both feet inside safe margins.","required":true},{"criterionId":"combat-readability","description":"A grounded ready-idle silhouette reads clearly at combat-icon scale without a weapon.","required":true},{"criterionId":"one-star-ceiling","description":"No magic, affinity cue, aura, elite armor, frame, star, UI, text, or supernatural effect is present.","required":true}],"canonicalPrompt":{"sha256":"8d8e7dcd511f33053f14f729d1e014797213ce88f8b7ce2f7450ff2d84076d6a","text":"Create exactly one full-body Summonlab combat chibi derived only from the supplied verified summon portrait. Canvas 1024 x 1536. Keep the character an adult and unmistakably the exact same person; simplify shapes for a clean painterly combat-game chibi. PROPORTION LOCK: the complete head-and-hair unit occupies 32 to 36 percent of the standing figure height, producing 2.75 to 3.1 heads total. Use a clearly oversized adult head, compact torso, and shortened legs; never render a 3.5-head, 4-head, or tall-miniature figure. Preserve relative body widths without generic inflation of the body. Use a grounded ready-idle three-quarter pose, both empty hands and both feet completely visible, with a generous safe margin and a warm pale parchment studio wash.\n\nIdentity continuity: Quinon Ulenek, age 29, gender presentation man, skin-value band 6; long narrow face; deep-set eyes and a heavy level brow; small upturned nose, heavy lower lip; faint freckles Preserve adult age cues, face geometry, skin, and expression; use a calm closed mouth with no smile or theatrical acting. Enlarge the cranium for chibi scale without replacing the source eye shape, eye spacing, brow structure, nose, mouth, jaw, or cheek planes with a shared generic doll-face template; the roster must retain visibly different adult faces at combat scale. Body continuity: clearly-muscular, short; 160 cm; clearly muscular construction with readable shoulders, back, legs, and forearms. Preserve shoulder and torso width, mass, softness, muscle distribution, upper-arm and forearm girth, wrist scale, hand size, leg mass, and posture. Do not make the arms, hands, shoulders, torso, or body fatter or bulkier merely because this is chibi. Tall or slight identity must read through shape and posture without shrinking the head below the required chibi ratio.\n\nHair continuity: dark-brown curls-coils-halo; accent: high gathered coil mass. Preserve the front and side silhouette of curls-coils-halo, the parting, gathered mass, shaved areas, and high gathered coil mass; color remains dark-brown. Wardrobe continuity: asymmetric-patchwork in plum-gray; intentional patchwork layers with an uneven hem, visible repairs, and practical trousers; low-profile toggles and articulated knee folds. Condition: deliberately tousled but clean. Preserve every visible seam, repair, closure, accessory, tattoo, marking, and palette relationship that survives at chibi scale. Personal anchors: no accessory or tattoo. Add nothing new.\n\nThe sole reference is the exact candidate authorized by summon target quinon-ulenek-summon-v1 and verified result quinon-ulenek-summon-v1-result at assets/heroes/experiments/one-star-overnight-200-001/waves/wave-05/results/quinon-ulenek/summon-v1.json; these identifiers are provenance only and must not appear in the image. No other identity, anatomy, wardrobe, or style reference is authorized. No weapon, attack, armor upgrade, magic, aura, glow, affinity cue, elemental gem, floating, frame, star, number, UI, text, label, logo, watermark, extra person, duplicate anatomy, cropped extremity, baby proportions, photographic finish, plastic 3D, or published-character resemblance."},"correctionSource":null,"experimentId":"one-star-overnight-200-001","heroId":"quinon-ulenek","heroSpec":{"details":{"anchors":[],"coolnessAnchor":"repairs-patina-keepsake","density":0,"tattooScope":"none"},"hair":{"accent":"high gathered coil mass","chibiReadability":"Preserve the front and side silhouette of curls-coils-halo, the parting, gathered mass, shaved areas, and high gathered coil mass; color remains dark-brown.","colorFamily":"dark-brown","silhouetteFamily":"curls-coils-halo"},"identity":{"age":29,"displayName":"Quinon Ulenek","faceDescription":"long narrow face; deep-set eyes and a heavy level brow; small upturned nose, heavy lower lip; faint freckles","gender":"man","identitySignature":"99d6094194e617464ba93ee257ae29c4d9487d67602387df3f0cc8e9043407f6","skinValueBand":6},"kernel":{"colorOrnamentTaste":"balances one confident color field against quiet neutrals; accepts one cherished personal detail.","counterTrait":"finds formal authority faintly funny","culturalFragments":["prefers handloom cloth with visible slubs","uses food spice order to mark seasons"],"dominantTrait":"bluntly candid","groomingAttitude":"deliberately tousled but clean","lifeEcho":"field labor","nonInference":"Do not infer aptitude, intelligence, spirit, morality, combat role, rarity, or biography from body, face, gender, skin, age, or phenotype.","poseCue":"stance is broad and still, with one palm turned slightly upward","socialPresentation":"lively and skeptical","tension":"Appears lively and skeptical, yet finds formal authority faintly funny."},"physique":{"bodyType":"clearly-muscular","description":"160 cm; clearly muscular construction with readable shoulders, back, legs, and forearms.","heightBand":"short"},"wardrobe":{"condition":"deliberately tousled but clean","description":"intentional patchwork layers with an uneven hem, visible repairs, and practical trousers; low-profile toggles and articulated knee folds.","family":"asymmetric-patchwork","paletteFamily":"plum-gray"}},"imageKind":"combat-chibi","output":{"candidatePath":"assets/heroes/experiments/one-star-overnight-200-001/waves/wave-05/candidates/quinon-ulenek/combat-chibi-v1.png","resultPath":"assets/heroes/experiments/one-star-overnight-200-001/waves/wave-05/results/quinon-ulenek/combat-chibi-v1.json"},"presentation":{"composition":"One adult combat chibi, 2.75-3.1 heads tall with head-and-hair occupying 32-36% of standing height, grounded three-quarter ready-idle, both empty hands and both feet visible inside generous safe margins.","height":1536,"mediaType":"image/png","negativeConstraints":["no body, shoulder, arm, forearm, wrist, hand, or body-fat inflation","no identity, age, hair, wardrobe, palette, accessory, tattoo, or marking drift","no weapon, armor upgrade, magic, aura, glow, affinity cue, gem, or floating","no frame, star, number, UI, text, logo, watermark, extra person, crop, or duplicate anatomy","no baby proportions, photography, plastic 3D, or published-character resemblance"],"width":1024},"productionState":"candidate-only","references":[{"path":"assets/heroes/experiments/one-star-overnight-200-001/waves/wave-05/candidates/quinon-ulenek/summon-v1.png","purpose":"Sole identity, anatomy, age, body, arm, hand, hair, wardrobe, palette, accessory, and marking authority from verified summon target quinon-ulenek-summon-v1 and result quinon-ulenek-summon-v1-result at assets/heroes/experiments/one-star-overnight-200-001/waves/wave-05/results/quinon-ulenek/summon-v1.json.","role":"identity-anatomy-authority","sha256":"cef7798778dd7d1d71e6eb89df7fb1f8769851fb4064d48570fdd76d91aa9131"}],"schemaVersion":"hero-one-star-image-target-v1","sourceSummon":{"candidatePath":"assets/heroes/experiments/one-star-overnight-200-001/waves/wave-05/candidates/quinon-ulenek/summon-v1.png","resultPath":"assets/heroes/experiments/one-star-overnight-200-001/waves/wave-05/results/quinon-ulenek/summon-v1.json","sha256":"cef7798778dd7d1d71e6eb89df7fb1f8769851fb4064d48570fdd76d91aa9131","targetId":"quinon-ulenek-summon-v1"},"starLevel":1,"targetId":"quinon-ulenek-combat-chibi-v1","targetVersion":1,"waveId":"wave-05"}
