{"acceptanceCriteria":[{"criterionId":"identity-continuity","description":"The adult face, skin, age cues, and identity remain unmistakably the summon hero.","required":true},{"criterionId":"body-continuity","description":"Height language, shoulder width, torso width, mass, softness, and musculature match the summon.","required":true},{"criterionId":"arm-hand-continuity","description":"Upper arms, forearms, wrists, and hands preserve source proportions without generic chibi inflation.","required":true},{"criterionId":"hair-continuity","description":"Hair color, front and side silhouette, parting, gathered mass, shaved areas, and accents match the summon.","required":true},{"criterionId":"wardrobe-continuity","description":"Garment construction, palette, repairs, accessories, tattoos, and personal anchors match the summon.","required":true},{"criterionId":"chibi-ratio","description":"The adult combat chibi is 2.75 through 3.1 heads tall: the complete head-and-hair unit occupies about 32 through 36 percent of standing height, never 3.5 or 4 heads tall.","required":true},{"criterionId":"complete-full-body","description":"Exactly one full-body subject has the entire head, both hands, and both feet inside safe margins.","required":true},{"criterionId":"combat-readability","description":"A grounded ready-idle silhouette reads clearly at combat-icon scale without a weapon.","required":true},{"criterionId":"one-star-ceiling","description":"No magic, affinity cue, aura, elite armor, frame, star, UI, text, or supernatural effect is present.","required":true}],"canonicalPrompt":{"sha256":"1a984c280b12616ee9446d68642fcf7dd14f6830157bdf5fdba2a824347935f0","text":"Create exactly one full-body Summonlab combat chibi derived only from the supplied verified summon portrait. Canvas 1024 x 1536. Keep the character an adult and unmistakably the exact same person; simplify shapes for a clean painterly combat-game chibi. PROPORTION LOCK: the complete head-and-hair unit occupies 32 to 36 percent of the standing figure height, producing 2.75 to 3.1 heads total. Use a clearly oversized adult head, compact torso, and shortened legs; never render a 3.5-head, 4-head, or tall-miniature figure. Preserve relative body widths without generic inflation of the body. Use a grounded ready-idle three-quarter pose, both empty hands and both feet completely visible, with a generous safe margin and a warm pale parchment studio wash.\n\nIdentity continuity: Brinia Ulenai, age 22, gender presentation woman, skin-value band 6; long narrow face; full cheeks and sharply defined brows; small upturned nose, heavy lower lip; subtle age lines Preserve adult age cues, face geometry, skin, and expression; use a calm closed mouth with no smile or theatrical acting. Enlarge the cranium for chibi scale without replacing the source eye shape, eye spacing, brow structure, nose, mouth, jaw, or cheek planes with a shared generic doll-face template; the roster must retain visibly different adult faces at combat scale. Body continuity: athletic-conditioned, medium; 177 cm; conditioned athletic construction with functional tone but no ripped definition. Preserve shoulder and torso width, mass, softness, muscle distribution, upper-arm and forearm girth, wrist scale, hand size, leg mass, and posture. Do not make the arms, hands, shoulders, torso, or body fatter or bulkier merely because this is chibi. Tall or slight identity must read through shape and posture without shrinking the head below the required chibi ratio.\n\nHair continuity: multicolor-split-streak short-textured-crop; accent: contrasting side length. Preserve the front and side silhouette of short-textured-crop, the parting, gathered mass, shaved areas, and contrasting side length; color remains multicolor-split-streak. Wardrobe continuity: fitted-vest-system in teal-brown; a fitted cloth vest system over a soft shirt, high-waist trousers, and flexible boots; a high soft collar and uneven layered hems. Condition: practical grooming with one carefully perfected detail. Preserve every visible seam, repair, closure, accessory, tattoo, marking, and palette relationship that survives at chibi scale. Personal anchors: one mismatched earring. Add nothing new.\n\nThe sole reference is the exact candidate authorized by summon target brinia-ulenai-summon-v1 and verified result brinia-ulenai-summon-v1-result at assets/heroes/experiments/one-star-overnight-200-001/waves/wave-04/results/brinia-ulenai/summon-v1.json; these identifiers are provenance only and must not appear in the image. No other identity, anatomy, wardrobe, or style reference is authorized. No weapon, attack, armor upgrade, magic, aura, glow, affinity cue, elemental gem, floating, frame, star, number, UI, text, label, logo, watermark, extra person, duplicate anatomy, cropped extremity, baby proportions, photographic finish, plastic 3D, or published-character resemblance."},"correctionSource":null,"experimentId":"one-star-overnight-200-001","heroId":"brinia-ulenai","heroSpec":{"details":{"anchors":["one mismatched earring"],"coolnessAnchor":"jewelry-hardware","density":1,"tattooScope":"none"},"hair":{"accent":"contrasting side length","chibiReadability":"Preserve the front and side silhouette of short-textured-crop, the parting, gathered mass, shaved areas, and contrasting side length; color remains multicolor-split-streak.","colorFamily":"multicolor-split-streak","silhouetteFamily":"short-textured-crop"},"identity":{"age":22,"displayName":"Brinia Ulenai","faceDescription":"long narrow face; full cheeks and sharply defined brows; small upturned nose, heavy lower lip; subtle age lines","gender":"woman","identitySignature":"b1255c71320852239d9a215a4ba881744e053f7c17cd8070c64eeca8e89b6ec2","skinValueBand":6},"kernel":{"colorOrnamentTaste":"lets faded and repaired areas vary the palette; avoids ornament unless it serves a fastening purpose.","counterTrait":"prefers improvisation despite careful grooming","culturalFragments":["values carved wood closures over metal","gives bright thread as a promise of return"],"dominantTrait":"ceremoniously hospitable","groomingAttitude":"practical grooming with one carefully perfected detail","lifeEcho":"travel","nonInference":"Do not infer aptitude, intelligence, spirit, morality, combat role, rarity, or biography from body, face, gender, skin, age, or phenotype.","poseCue":"chin remains level while one hand lightly checks a cuff seam","socialPresentation":"calm and appraising","tension":"Appears calm and appraising, yet prefers improvisation despite careful grooming."},"physique":{"bodyType":"athletic-conditioned","description":"177 cm; conditioned athletic construction with functional tone but no ripped definition.","heightBand":"medium"},"wardrobe":{"condition":"practical grooming with one carefully perfected detail","description":"a fitted cloth vest system over a soft shirt, high-waist trousers, and flexible boots; a high soft collar and uneven layered hems.","family":"fitted-vest-system","paletteFamily":"teal-brown"}},"imageKind":"combat-chibi","output":{"candidatePath":"assets/heroes/experiments/one-star-overnight-200-001/waves/wave-04/candidates/brinia-ulenai/combat-chibi-v1.png","resultPath":"assets/heroes/experiments/one-star-overnight-200-001/waves/wave-04/results/brinia-ulenai/combat-chibi-v1.json"},"presentation":{"composition":"One adult combat chibi, 2.75-3.1 heads tall with head-and-hair occupying 32-36% of standing height, grounded three-quarter ready-idle, both empty hands and both feet visible inside generous safe margins.","height":1536,"mediaType":"image/png","negativeConstraints":["no body, shoulder, arm, forearm, wrist, hand, or body-fat inflation","no identity, age, hair, wardrobe, palette, accessory, tattoo, or marking drift","no weapon, armor upgrade, magic, aura, glow, affinity cue, gem, or floating","no frame, star, number, UI, text, logo, watermark, extra person, crop, or duplicate anatomy","no baby proportions, photography, plastic 3D, or published-character resemblance"],"width":1024},"productionState":"candidate-only","references":[{"path":"assets/heroes/experiments/one-star-overnight-200-001/waves/wave-04/candidates/brinia-ulenai/summon-v1.png","purpose":"Sole identity, anatomy, age, body, arm, hand, hair, wardrobe, palette, accessory, and marking authority from verified summon target brinia-ulenai-summon-v1 and result brinia-ulenai-summon-v1-result at assets/heroes/experiments/one-star-overnight-200-001/waves/wave-04/results/brinia-ulenai/summon-v1.json.","role":"identity-anatomy-authority","sha256":"221c9d3e2e98022c33f3097dcecead312b42999d81acbf0ecc585da1f1404a2d"}],"schemaVersion":"hero-one-star-image-target-v1","sourceSummon":{"candidatePath":"assets/heroes/experiments/one-star-overnight-200-001/waves/wave-04/candidates/brinia-ulenai/summon-v1.png","resultPath":"assets/heroes/experiments/one-star-overnight-200-001/waves/wave-04/results/brinia-ulenai/summon-v1.json","sha256":"221c9d3e2e98022c33f3097dcecead312b42999d81acbf0ecc585da1f1404a2d","targetId":"brinia-ulenai-summon-v1"},"starLevel":1,"targetId":"brinia-ulenai-combat-chibi-v1","targetVersion":1,"waveId":"wave-04"}
